{
  "$schema": "../../schema/v6.json",
  "url": "https://bitfinity.postman.co/workspace/Bitfinity~0878e325-dcc5-4adf-b37e-ac68386085f4/collection/4699480-5297d2ce-9573-4bca-a65b-5451c9809055?action=share&creator=4699480",
  "dir": "./__tests__/e2e/swagger-output-1",
  "language": "kotlin",
  "kotlinPackage": "com.wms.wms.data.api",
  "ignore": {
    "headerParams": ["Accept", "Content-Encoding", "Content-Type"]
  }
}
